{
  "document": {
    "id": "troubleshooting--ref-issues",
    "title": "Ref 시스템 문제",
    "category": "guide",
    "source_path": "ko/troubleshooting/ref-issues.md",
    "lastModified": "2025-12-27T06:25:41.967Z",
    "wordCount": 304
  },
  "priority": {
    "score": 50,
    "tier": "reference",
    "rationale": "Default priority assigned during documentation synchronization.",
    "reviewDate": "2026-07-24",
    "autoCalculated": true
  },
  "purpose": {
    "primary_goal": "Understand and apply the guidance in Ref 시스템 문제.",
    "target_audience": [
      "framework-users"
    ],
    "use_cases": [
      "Learn the guide concepts described in Ref 시스템 문제.",
      "Use the document as an implementation reference."
    ],
    "learning_objectives": [
      "Identify the essential ideas and usage guidance in Ref 시스템 문제."
    ]
  },
  "keywords": {
    "primary": [
      "troubleshooting",
      "tsx",
      "ref",
      "시스템",
      "문제"
    ],
    "technical": [
      "tsx",
      "troubleshooting",
      "context-action"
    ],
    "functional": [
      "guide",
      "documentation",
      "framework"
    ]
  },
  "extraction": {
    "strategy": "tutorial-first",
    "character_limits": {
      "100": {
        "focus": "Summarize the essential guide information from Ref 시스템 문제.",
        "structure": "Lead with the main purpose, then preserve actionable details.",
        "must_include": [
          "Ref 시스템 문제",
          "troubleshooting",
          "tsx"
        ],
        "avoid": [
          "Unsupported claims",
          "Unrelated implementation details"
        ]
      },
      "200": {
        "focus": "Summarize the essential guide information from Ref 시스템 문제.",
        "structure": "Lead with the main purpose, then preserve actionable details.",
        "must_include": [
          "Ref 시스템 문제",
          "troubleshooting",
          "tsx"
        ],
        "avoid": [
          "Unsupported claims",
          "Unrelated implementation details"
        ]
      },
      "300": {
        "focus": "Summarize the essential guide information from Ref 시스템 문제.",
        "structure": "Lead with the main purpose, then preserve actionable details.",
        "must_include": [
          "Ref 시스템 문제",
          "troubleshooting",
          "tsx"
        ],
        "avoid": [
          "Unsupported claims",
          "Unrelated implementation details"
        ]
      },
      "500": {
        "focus": "Summarize the essential guide information from Ref 시스템 문제.",
        "structure": "Lead with the main purpose, then preserve actionable details.",
        "must_include": [
          "Ref 시스템 문제",
          "troubleshooting",
          "tsx"
        ],
        "avoid": [
          "Unsupported claims",
          "Unrelated implementation details"
        ]
      },
      "1000": {
        "focus": "Summarize the essential guide information from Ref 시스템 문제.",
        "structure": "Lead with the main purpose, then preserve actionable details.",
        "must_include": [
          "Ref 시스템 문제",
          "troubleshooting",
          "tsx"
        ],
        "avoid": [
          "Unsupported claims",
          "Unrelated implementation details"
        ]
      },
      "2000": {
        "focus": "Summarize the essential guide information from Ref 시스템 문제.",
        "structure": "Lead with the main purpose, then preserve actionable details.",
        "must_include": [
          "Ref 시스템 문제",
          "troubleshooting",
          "tsx"
        ],
        "avoid": [
          "Unsupported claims",
          "Unrelated implementation details"
        ]
      },
      "5000": {
        "focus": "Summarize the essential guide information from Ref 시스템 문제.",
        "structure": "Lead with the main purpose, then preserve actionable details.",
        "must_include": [
          "Ref 시스템 문제",
          "troubleshooting",
          "tsx"
        ],
        "avoid": [
          "Unsupported claims",
          "Unrelated implementation details"
        ]
      }
    },
    "emphasis": {
      "must_include": [
        "Ref 시스템 문제",
        "troubleshooting",
        "tsx"
      ],
      "nice_to_have": [
        "tsx",
        "troubleshooting",
        "context-action"
      ],
      "contextual_keywords": [
        "troubleshooting",
        "tsx",
        "ref",
        "시스템",
        "문제"
      ]
    }
  },
  "tags": {
    "primary": [
      "tutorial"
    ],
    "secondary": [
      "troubleshooting",
      "tsx",
      "ref",
      "시스템",
      "문제"
    ],
    "audience": [
      "framework-users"
    ],
    "complexity": "basic",
    "lastUpdated": "2026-07-24"
  },
  "dependencies": {
    "prerequisites": [],
    "references": [],
    "followups": [],
    "conflicts": [],
    "complements": []
  },
  "metadata": {
    "description": "Ref 시스템 문제 is guide documentation for the Context-Action framework, covering core concepts and practical usage.",
    "language": "ko",
    "created": "2026-07-24",
    "updated": "2026-07-24",
    "version": "1.0.0",
    "original_size": 2448,
    "created_at": "2026-07-24T05:15:02.438Z",
    "source_last_modified": "2025-12-27T06:25:41.967Z",
    "keywords": {
      "primary": [
        "troubleshooting",
        "tsx",
        "ref",
        "시스템",
        "문제"
      ],
      "technical": [
        "tsx",
        "troubleshooting",
        "context-action"
      ],
      "functional": [
        "guide",
        "documentation",
        "framework"
      ]
    }
  }
}